{"organizations": [], "uuid": "dfabb34b7d146f1643268fe59b0fbb4732c32ebf", "thread": {"social": {"gplus": {"shares": 0}, "pinterest": {"shares": 0}, "vk": {"shares": 0}, "linkedin": {"shares": 0}, "facebook": {"likes": 0, "shares": 0, "comments": 0}, "stumbledupon": {"shares": 0}}, "site_full": "www.chroniclelive.co.uk", "main_image": "http://i3.chroniclelive.co.uk/incoming/article11738509.ece/ALTERNATES/s1200/JS96879059.jpg", "site_section": "http://www.chroniclelive.co.uk/news/?service=rss", "section_title": "nechronicle - News", "url": "http://www.chroniclelive.co.uk/news/north-east-news/labour-leader-jeremy-corbyn-outline-11738461", "country": "GB", "domain_rank": 21960, "title": "Labour leader Jeremy Corbyn will outline plans for a 'Bank of the North' at Sunderland rally", "performance_score": 0, "site": "chroniclelive.co.uk", "participants_count": 1, "title_full": "Labour leader Jeremy Corbyn will outline plans for a 'Bank of the North' at Sunderland rally", "spam_score": 0.0, "site_type": "news", "published": "2016-08-12T12:30:00.000+03:00", "replies_count": 0, "uuid": "dfabb34b7d146f1643268fe59b0fbb4732c32ebf"}, "author": "Michael Muncaster", "url": "http://www.chroniclelive.co.uk/news/north-east-news/labour-leader-jeremy-corbyn-outline-11738461", "ord_in_thread": 0, "title": "Labour leader Jeremy Corbyn will outline plans for a 'Bank of the North' at Sunderland rally", "locations": [], "entities": {"persons": [{"name": "jeremy corbyn", "sentiment": "none"}, {"name": "corbyn", "sentiment": "none"}, {"name": "brexit", "sentiment": "none"}, {"name": "john mcdonnell", "sentiment": "none"}, {"name": "danny lawson/pa", "sentiment": "none"}], "locations": [{"name": "britain", "sentiment": "none"}, {"name": "north east", "sentiment": "none"}, {"name": "sunderland", "sentiment": "none"}, {"name": "england", "sentiment": "none"}, {"name": "keel square", "sentiment": "none"}, {"name": "eu", "sentiment": "none"}, {"name": "north", "sentiment": "none"}], "organizations": [{"name": "labour", "sentiment": "none"}, {"name": "sunderland", "sentiment": "none"}, {"name": "european union", "sentiment": "none"}, {"name": "hilton newcastle gateshead hotel  labour", "sentiment": "none"}, {"name": "labour party", "sentiment": "none"}, {"name": "eu", "sentiment": "none"}, {"name": "wire labour", "sentiment": "none"}, {"name": "national investment bank", "sentiment": "none"}, {"name": "jeremy for labour", "sentiment": "none"}, {"name": "labour government", "sentiment": "none"}]}, "highlightText": "", "language": "english", "persons": [], "text": "Labour leader Jeremy Corbyn will outline plans for a 'Bank of the North' at Sunderland rally 05:30, 12 Aug 2016 Labour wants to set up a National Investment Bank and a network of regional banks to ensure the north of England receives investment Shares Get daily news by email Danny Lawson/PA Wire Labour leader Jeremy Corbyn arrives ahead of a Labour leadership hustings at the Hilton Newcastle Gateshead hotel \nLabour leader Jeremy Corbyn will today outline plans for a “Bank of the North” to ensure every part of the north of England receives investment. \nMr Corbyn will be speaking at a rally in Sunderland where he will reaffirm the party’s version to “unlock” £500 billion of investment for businesses. \nLabour wants to set up a National Investment Bank and a network of regional banks to “rebuild Britain’s industries after years of neglect”. \nThe aim would be to encourage private sector investment in businesses to help create 100,000 additional well-paid, secure jobs across the North East. \nMr Corbyn said it would help “left behind” communities which voted to leave the European Union and who feel they have been forgotten by successive governments. Video loading Click to play Tap to play The Live Event you are trying to watch is either unavailable or has not started Please refresh this page in your browser to reload this live event video \nHe said: “Under my leadership, a Labour Government will create a ‘Bank of the North’ so that no community in the North is left behind. \n“This would help to deliver infrastructure, manufacturing and new industries backed up by a publicly-owned National Investment Bank and regional banks. \n“Our plan is to build a high skilled, high tech, low carbon economy which has the potential to unlock 100,000 additional secure jobs across the North East.” \nShadow Chancellor John McDonnell has previously spoken in favour of the plans and claimed regions such as the North East would be hit hardest by leaving the EU. \nHe said: “The North-East exports more goods to the EU than any other English region, per head of population. \n“It also receives more EU structural funding support than any other English region. \n“The Government needs to tell us, now, what it’s going to do to stop North East’s trade relationships being damaged by Brexit.” \nThe Jeremy for Labour rally will take place in Keel Square, Sunderland, from 11.30am to 1pm. Labour Party in crisis", "external_links": [], "published": "2016-08-12T12:30:00.000+03:00", "crawled": "2016-08-12T10:28:28.238+03:00", "highlightTitle": ""}