{"organizations": ["Jeremy Corbyn Another North East", "Sunderland", "Labour", "Getty Images Sharon Hodgson  Washington", "Middlesbrough", "Durham", "Party", "Parliamentary Labour Party", "Labour Party", "Sunderland West", "EU"], "uuid": "96ce0cac8ce17abf03b6ee5a0719c1280c81f4a2", "thread": {"social": {"gplus": {"shares": 0}, "pinterest": {"shares": 0}, "vk": {"shares": 0}, "linkedin": {"shares": 0}, "facebook": {"likes": 0, "shares": 0, "comments": 0}, "stumbledupon": {"shares": 0}}, "site_full": "www.chroniclelive.co.uk", "main_image": "http://i4.chroniclelive.co.uk/incoming/article10100309.ece/ALTERNATES/s1200/CS84932546.jpg", "site_section": "http://www.thejournal.co.uk/news/?service=rss", "section_title": "nechronicle - News", "url": "http://www.chroniclelive.co.uk/news/north-east-news/another-north-east-mp-joined-11533832", "country": "GB", "domain_rank": 21960, "title": "Another North East MP has joined the revolt against Jeremy Corbyn", "performance_score": 0, "site": "chroniclelive.co.uk", "participants_count": 1, "title_full": "Another North East MP has joined the revolt against Jeremy Corbyn", "spam_score": 0.0, "site_type": "news", "published": "2016-06-27T22:46:00.000+03:00", "replies_count": 0, "uuid": "96ce0cac8ce17abf03b6ee5a0719c1280c81f4a2"}, "author": "Hannah Graham", "url": "http://www.chroniclelive.co.uk/news/north-east-news/another-north-east-mp-joined-11533832", "ord_in_thread": 0, "title": "Another North East MP has joined the revolt against Jeremy Corbyn", "locations": ["North West Durham", "Shadow Northern Ireland", "Easington", "London"], "entities": {"persons": [{"name": "jeremy corbyn", "sentiment": "none"}, {"name": "pat glass", "sentiment": "none"}, {"name": "roberta blackman-woods", "sentiment": "none"}, {"name": "sharon hodgson", "sentiment": "none"}, {"name": "haron hodgson", "sentiment": "none"}, {"name": "andy mcdonald", "sentiment": "none"}, {"name": "corbyn", "sentiment": "none"}, {"name": "brexit", "sentiment": "none"}, {"name": "dave anderson", "sentiment": "none"}, {"name": "hodgson", "sentiment": "none"}, {"name": "grahame morris", "sentiment": "none"}, {"name": "blaydon", "sentiment": "none"}], "locations": [{"name": "north west durham", "sentiment": "none"}, {"name": "shadow northern ireland", "sentiment": "none"}, {"name": "easington", "sentiment": "none"}, {"name": "london", "sentiment": "none"}], "organizations": [{"name": "jeremy corbyn another north east", "sentiment": "none"}, {"name": "sunderland", "sentiment": "none"}, {"name": "labour", "sentiment": "none"}, {"name": "getty images sharon hodgson  washington", "sentiment": "none"}, {"name": "middlesbrough", "sentiment": "none"}, {"name": "durham", "sentiment": "none"}, {"name": "party", "sentiment": "none"}, {"name": "parliamentary labour party", "sentiment": "none"}, {"name": "labour party", "sentiment": "none"}, {"name": "sunderland west", "sentiment": "none"}, {"name": "eu", "sentiment": "none"}]}, "highlightText": "", "language": "english", "persons": ["Jeremy Corbyn", "Pat Glass", "Roberta Blackman-Woods", "Sharon Hodgson", "haron Hodgson", "Andy McDonald", "Corbyn", "Brexit", "Dave Anderson", "Hodgson", "Grahame Morris", "Blaydon"], "text": "Another North East MP has joined the revolt against Jeremy Corbyn 20:46, 27 Jun 2016 Sunderland MP Sharon Hodgson has resigned condemning Corbyn's 'lacklustre\" EU campaign Shares Get daily news by email 2011 Getty Images Sharon Hodgson \nWashington and Sunderland West MP Sharon Hodgson has joined the rebellion against Jeremy Corbyn. \nShe resigned her post as Shadow Minister for Children and Families on Monday, condemning Mr Corbyn’s campaign against Brexit as “lacklustre” and saying he could not command the support of the wider parliamentary Labour Party. \nAnnouncing her decision on Twitter, the former Shadow Minister said she felt “great regret”. \nIn her resignation letter, she said that, although she had not supported Mr Corbyn ’s leadership campaign, she had welcomed the opportunity to serve on the front bench and had not taken the decision to stand down lightly. \nBut she said: “Now, more than ever, we need a united and effective opposition... and I am not confident that you can give us that leadership.” Labour Party leader Jeremy Corbyn leaves his home in north London \nShe added: “This is even more concerning now that the extent of your ambivalence and lacklustre campaigning to remain in the EU has come to light.” \nExpressing her concern that a snap election could approaching, she said that if the party were to face election under its current leadership it might be “fighting for its very existence” \nShe added: “I am concerned that this will leave the people we both came into politics to help and serve in a far worse position, abandoned for a generation.” \nMs Hodgson called on Mr Corbyn to do “the honourable, decent and selfless thing” in stepping down. \n“I want you to be remembered as the Labour Leader who reinvigorated our membership,” she told him, “not the Labour Leader who irreparably broke the Party we both hold so dear.” \nWhile 46 shadow front bench members, including Durham’s Roberta Blackman-Woods, have now stepped down, the resulting reshuffle has lead to top jobs for others from the region. Ian Forsyth/Getty Images Pat Glass MP \nPat Glass, the Labour MP for North West Durham, becomes the new Shadow Education Secretary. She had been the Shadow Europe Minister. \nEasington MP Grahame Morris becomes Shadow Secretary of State for Communities and Local Government and Shadow Minister for the Constitutional Convention. \nDave Anderson , Labour MP for Blaydon, is the new Shadow Northern Ireland Secretary. He was previously a party whip. \nAnd Andy McDonald, Labour MP for Middlesbrough, is promoted from his role as a shadow transport minister to become the new Shadow Transport Secretary. \nThe Parliamentary Labour Party is set to go ahead with a no-confidence vote against Mr Corbyn’s aides insisted the leader would not quit. \nHe has previously said he would stand again for election, if forced to step down, pointing to the large mandate he holds from grassroots labour members.", "external_links": [], "published": "2016-06-27T22:46:00.000+03:00", "crawled": "2016-06-27T23:02:07.520+03:00", "highlightTitle": ""}