{"organizations": ["European Parliament", "Queen Elizabeth High School", "WTO", "EU", "World Trade Organisation", "Hexham", "UKIP"], "uuid": "45423d36f5192e09e8197a6033eebac2957bbaef", "thread": {"social": {"gplus": {"shares": 0}, "pinterest": {"shares": 0}, "vk": {"shares": 0}, "linkedin": {"shares": 0}, "facebook": {"likes": 0, "shares": 0, "comments": 0}, "stumbledupon": {"shares": 0}}, "site_full": "www.chroniclelive.co.uk", "main_image": "http://i2.chroniclelive.co.uk/incoming/article11428783.ece/ALTERNATES/s1200/JS91729107.jpg", "site_section": "", "section_title": "", "url": "http://www.chroniclelive.co.uk/news/north-east-news/north-east-meps-go-head-11428264", "country": "IE", "domain_rank": 21960, "title": "North East MEPs go head to head in EU referendum debate - Chronicle Live", "performance_score": 0, "site": "chroniclelive.co.uk", "participants_count": 0, "title_full": "North East MEPs go head to head in EU referendum debate - Chronicle Live", "spam_score": 0.0, "site_type": "news", "published": "2016-06-05T13:11:00.000+03:00", "replies_count": 0, "uuid": "45423d36f5192e09e8197a6033eebac2957bbaef"}, "author": "Katie Dickinson", "url": "http://www.chroniclelive.co.uk/news/north-east-news/north-east-meps-go-head-11428264", "ord_in_thread": 0, "title": "North East MEPs go head to head in EU referendum debate - Chronicle Live", "locations": ["Britain", "North East of Britain", "North East", "European Union", "Sunderland", "UK", "Europe", "EU", "Hexham"], "entities": {"persons": [{"name": "opperman", "sentiment": "none"}, {"name": "kirton-darling", "sentiment": "none"}, {"name": "arnott", "sentiment": "none"}, {"name": "andy saunders", "sentiment": "none"}, {"name": "guy opperman", "sentiment": "none"}, {"name": "brexit", "sentiment": "none"}, {"name": "jonathan arnott", "sentiment": "none"}, {"name": "george hepburn", "sentiment": "none"}, {"name": "jude kirton-darling", "sentiment": "none"}], "locations": [{"name": "britain", "sentiment": "none"}, {"name": "north east of britain", "sentiment": "none"}, {"name": "north east", "sentiment": "none"}, {"name": "european union", "sentiment": "none"}, {"name": "sunderland", "sentiment": "none"}, {"name": "uk", "sentiment": "none"}, {"name": "europe", "sentiment": "none"}, {"name": "eu", "sentiment": "none"}, {"name": "hexham", "sentiment": "none"}], "organizations": [{"name": "european parliament", "sentiment": "none"}, {"name": "queen elizabeth high school", "sentiment": "none"}, {"name": "wto", "sentiment": "none"}, {"name": "eu", "sentiment": "none"}, {"name": "world trade organisation", "sentiment": "none"}, {"name": "hexham", "sentiment": "none"}, {"name": "ukip", "sentiment": "none"}]}, "highlightText": "", "language": "english", "persons": ["Opperman", "Kirton-Darling", "Arnott", "Andy Saunders", "Guy Opperman", "Brexit", "Jonathan Arnott", "George Hepburn", "Jude Kirton-Darling"], "text": "North East MEPs go head to head in EU referendum debate 10:11, 5 Jun 2016 Jonathan Arnott and Jude Kirton-Darling argued for and against Brexit at a debate in Hexham Shares Get daily news by email From left: Guy Opperman MP, chair George Hepburn, Jude Kirton-Darling MEP and Andy Saunders \nNorth East MEPs went head to head in a debate on whether Britain should leave or stay in the European Union . \nThe event at Queen Elizabeth High School, in Hexham , saw politicians from the Leave and Remain camps being grilled by locals. \nNorth East Labour MEP Jude Kirton-Darling and Hexham MP Guy Opperman were stating the case to remain, while UKIP MEP Jonathan Arnott and Britain for Business representative Andy Saunders argued for Brexit. \nMs Kirton-Darling said import tariffs would “kill” the automotive industry in the North East of Britain voted to leave. \nShe said: “80% of the cars made at Sunderland go to the European market and World Trade Organisation tariffs would kill the industry which supports tens of thousands of jobs in the North East, not just in manufacturing but in services,” she said. \n“As a country we are a service economy and we would be killing ourselves by applying WTO rules.” \nThe MEP also argued that the EU was “completely democratic”. \nShe added: “We can rewrite proposals and we can reject proposals we don’t want. \n“If you wanted you could watch European Parliament all day long – it’s the lack of interest from the British media which means it is not properly presented in the way Westminster is. \n“At the moment we are leading in Europe and our European partners are desperate for us to continue doing that.” \nThe EU referendum debate at Queen Elizabeth High School, Hexham \nBut fellow North East MEP Mr Arnott insisted the UK had “a 100% record of failure” in trying to change EU laws. \nHe said: “British MEPs don’t vote as a block, and therefore it’s difficult for them to stop something in the European Parliament. \n“We have only opposed 72 things and every single one of those has gone on to become law anyway.” \nMr Arnott added: “Sovereignty and security are intrinsically linked and we have seen the EU erode our sovereignty. \n“There are so many things we could do outside the EU, such as stop the over-fishing of our waters and regain control of our fishing industry.” \nDuring the debate the panel faced questions from audience members about democracy in Europe, the future of the Eurozone, and the role of the EU in international relations. \nOn the subject of diplomacy, Mr Opperman said: “We need to think about how we are going to cope with our problems in the future. \n“History shows us that if we isolate ourselves and build barriers, things get worse.” \nWhen asked about immigration Andy Saunders, of Britain for Business, said: “I’m quite ashamed of Britain over what we are doing with Syrian refugees – if we control immigration it may well be we can take in more people from refugee camps. \n“If companies can’t find workers with the skills they need, it will encourage them to get involved with local colleges and schools and train them to do the jobs that are needed, rather than bringing in labour from abroad.” ", "external_links": [], "published": "2016-06-05T13:11:00.000+03:00", "crawled": "2016-06-05T12:34:50.298+03:00", "highlightTitle": ""}