{"organizations": [], "uuid": "586fe3fd8c9f4f3d426431c1a9564a3f1863042e", "thread": {"social": {"gplus": {"shares": 0}, "pinterest": {"shares": 0}, "vk": {"shares": 0}, "linkedin": {"shares": 0}, "facebook": {"likes": 0, "shares": 0, "comments": 0}, "stumbledupon": {"shares": 0}}, "site_full": "www.devonlive.com", "main_image": "https://i2-prod.devonlive.com/incoming/article2089800.ece/ALTERNATES/s1200/0_Untitled-design-1.png", "site_section": "", "section_title": "", "url": "https://www.devonlive.com/news/devon-news/farage-rees-mogg-going-wetherspoons-2089698", "country": "US", "title": "Farage and Rees-Mogg are going for a Wetherspoons together as part of a Devon Brexit rally - Devon Live", "performance_score": 0, "site": "devonlive.com", "participants_count": 1, "title_full": "", "spam_score": 0.0, "site_type": "news", "published": "2018-10-09T03:00:00.000+03:00", "replies_count": 0, "uuid": "586fe3fd8c9f4f3d426431c1a9564a3f1863042e"}, "author": "Colleen Smith", "url": "https://www.devonlive.com/news/devon-news/farage-rees-mogg-going-wetherspoons-2089698", "ord_in_thread": 0, "title": "Farage and Rees-Mogg are going for a Wetherspoons together as part of a Devon Brexit rally - Devon Live", "locations": [], "entities": {"persons": [{"name": "rees-mogg", "sentiment": "none"}, {"name": "tim martin", "sentiment": "none"}, {"name": "wetherspoons", "sentiment": "none"}, {"name": "nigel farage", "sentiment": "none"}, {"name": "jacob rees-mogg", "sentiment": "none"}, {"name": "chuck chequers", "sentiment": "none"}], "locations": [{"name": "uk", "sentiment": "none"}, {"name": "devon", "sentiment": "none"}, {"name": "torquay harbour", "sentiment": "none"}, {"name": "riviera international centre", "sentiment": "none"}], "organizations": [{"name": "torquay", "sentiment": "none"}, {"name": "tory", "sentiment": "none"}, {"name": "ukip", "sentiment": "none"}]}, "highlightText": "", "language": "english", "persons": [], "text": "Click to play Tap to play The video will start in 8 Cancel Play now Get Daily updates directly to your inbox Subscribe Thank you for subscribing See our privacy notice Could not subscribe, try again later Invalid Email\nA Save Brexit rally is arriving in Devon this weekend with three of the campaign's most prominent public figures taking to the stage - former UKIP leader Nigel Farage, posh Tory MP Jacob Rees-Mogg and Wetherspoons' pub chain boss Tim Martin.\nThe three will share the stage at a rally on Saturday, October 13 at Torquay's Riviera International Centre as part of a nationwide tour of ‘Chuck Chequers’ rallies.\nNigel Farage will arrive ahead of the 2pm rally on the Leave Means Leave campaign bus.\nHe will meet fishermen at 10am on Torquay Harbour before going on walkabout.\nThe walkabout will end at The Green Ginger Wetherspoons pub on Fleet Walk. The rally at the conference centre runs from 2pm to 4pm. Read More\nThe Save Brexit Rally campaign said: \"Politicians from across the political spectrum will be uniting for a series of UK wide mass rallies protesting the Prime Minister’s Chequers plan.\" Toff with Jacob Rees-Mogg (Image: Instagram)\nRees-Mogg, whose constituency is Midsomer Norton in Somerset has previously announced he is a fan of Wetherspoons pubs for their \"good English food at good value\".\nIt's not known if he will be meeting his number one fan - I’m a Celebrity... queen, Torquay’s own Georgia Toffolo . She recently met Rees-Mogg to apologise for calling him a ‘sex god’ after she got the chance to talk to the ‘rather dishy’ MP in the Houses of Parliament. Tim Martin, founder and chairman of JD Wetherspoon at George's Meeting House, Exeter\nBrexiteer Tim Martin, owner of the JD Wetherspoons chain , has previously announced that his pubs will slash the number of European drinks and increase British-made booze.\nFormer UKIP leader Farage is hosting another event in Devon later this year. ‘ An audience with Nigel Farage’ will take place at Exmouth Pavilions on November 16 when the politician will talk about his life and career, as well as a Q&A session with the audience with tickets costing up to £45. Do you have a story to share or for us to investigate?\nGet in touch using or call 07584 591 375 or tweet me @colleentsmith\nWant more news?\nFor Devon news, find Devon Live's Facebook page here and Twitter here , or visit our homepage at www.devonlive.com Like us on Facebook", "external_links": [], "published": "2018-10-09T03:00:00.000+03:00", "crawled": "2018-10-09T16:54:47.029+03:00", "highlightTitle": ""}