{"organizations": ["British Retail Consortium", "EU", "Newcastle", "Intu Properties", "BRC", "Primark"], "uuid": "e034803a77cc0814ce1302029082e03f54368cef", "thread": {"social": {"gplus": {"shares": 0}, "pinterest": {"shares": 0}, "vk": {"shares": 0}, "linkedin": {"shares": 0}, "facebook": {"likes": 0, "shares": 0, "comments": 0}, "stumbledupon": {"shares": 0}}, "site_full": "www.chroniclelive.co.uk", "main_image": "http://i3.chroniclelive.co.uk/incoming/article11280748.ece/ALTERNATES/s1200/JS88961587.jpg", "site_section": "http://www.thejournal.co.uk/business/?service=rss", "section_title": "nechronicle - Business", "url": "http://www.chroniclelive.co.uk/business/business-news/metrocentre-eldon-square-owners-intu-11675871", "country": "GB", "domain_rank": 21960, "title": "Metrocentre and Eldon Square owners intu praise centres for strong trading", "performance_score": 0, "site": "chroniclelive.co.uk", "participants_count": 1, "title_full": "Metrocentre and Eldon Square owners intu praise centres for strong trading", "spam_score": 0.0, "site_type": "news", "published": "2016-07-28T16:11:00.000+03:00", "replies_count": 0, "uuid": "e034803a77cc0814ce1302029082e03f54368cef"}, "author": "Coreena Ford", "url": "http://www.chroniclelive.co.uk/business/business-news/metrocentre-eldon-square-owners-intu-11675871", "ord_in_thread": 0, "title": "Metrocentre and Eldon Square owners intu praise centres for strong trading", "locations": ["Eldon Square", "Metrocentre", "Smiggle", "Grey", "Spain", "intu Eldon Square", "intu Metrocentre", "UK", "Gateshead"], "entities": {"persons": [{"name": "intu", "sentiment": "none"}, {"name": "kiko", "sentiment": "none"}, {"name": "grey", "sentiment": "none"}, {"name": "matthew roberts", "sentiment": "none"}, {"name": "roberts", "sentiment": "none"}, {"name": "austin reed", "sentiment": "none"}], "locations": [{"name": "eldon square", "sentiment": "none"}, {"name": "metrocentre", "sentiment": "none"}, {"name": "smiggle", "sentiment": "none"}, {"name": "grey", "sentiment": "none"}, {"name": "spain", "sentiment": "none"}, {"name": "intu eldon square", "sentiment": "none"}, {"name": "intu metrocentre", "sentiment": "none"}, {"name": "uk", "sentiment": "none"}, {"name": "gateshead", "sentiment": "none"}], "organizations": [{"name": "british retail consortium", "sentiment": "none"}, {"name": "eu", "sentiment": "none"}, {"name": "newcastle", "sentiment": "none"}, {"name": "intu properties", "sentiment": "none"}, {"name": "brc", "sentiment": "none"}, {"name": "primark", "sentiment": "none"}]}, "highlightText": "", "language": "english", "persons": ["Intu", "Kiko", "Grey", "Matthew Roberts", "Roberts", "Austin Reed"], "text": "Metrocentre and Eldon Square owners intu praise centres for strong trading 14:11, 28 Jul 2016 The final restaurant at intu Eldon Square's new dining zone is also due to be announced within weeks Shares Get business news by email How the entrance to intu Eldon Square will look when work on the dining zone has finished \nThe Metrocentre and Eldon Square are among the star performers which have steered their owner Intu to strong half-year results. \nIntu Properties, which owns the Newcastle and Gateshead complexes, has posted strong figures for the first half of 2016, with like-for-like net rental income rising by 7.5% in the period as a result of increased occupancy, improving rental levels from new lettings and rent reviews. \nThe firm, which is the UK’s leading owner, manager and developer of prime regional shopping centres with a growing presence in Spain, said it signed 98 long-term leases for £17m new annual rent in the period, including 82 in the UK. \nDuring the six months to June 30, the firm completed the new £17m restaurant development at intu Metrocentre, and said it is on course to open intu Eldon Square’s new dining zone Grey’s Quarter this autumn. \nThe firm will open 20 new restaurants at the Newcastle complex, which has 140 stores, with 19 pre-let. Chief finance officer Matthew Roberts said contracts should soon be exchanged with the final restaurant operator. \nMr Roberts said: “We have seen some interest in the last site at Grey’s Quarter and should exchange contracts in the next few weeks. \n“The two centres are trading very well. Eldon Square is now at 99% occupancy and we only have a couple of empty units. \n“And we’ve seen good performance at the Metrocentre which is 93%, so both are trading strongly and there is good footfall so we are very pleased with what’s happening there.” \nThe figures only cover one week of trading post Brexit vote, and directors said it is too early for the full consequences of the EU vote to emerge. \nHowever since June 23, footfall has been in line with the first six months, and more firms have signed up to take on units across the firm’s 18 UK centres, suggesting its operations will not be affected by the referendum result. \nMr Roberts added: “We’ve seen no noticeable decline in business and in terms of lettings, 27 deals have been completed since June 27, some in the last week or so.” \nIn a review of the UK market, the firm said it was seeing retailers continue expansion and upsizing in prime high footfall retail destinations, including Primark at intu Metrocentre which has expanded its unit. \nInternational retailers are also expanding into the UK centre, with the likes of Smiggle, Tiger and Kiko opening up shops. \nRetailer administrations in the period including 10 BHS units and two Austin Reed, amounting to around 1% of intu’s rent roll. \nIntu’s success has been announced on the same day that a new report revealed “dramatic” structural change in the retail industry. \nMore stores have also closed, driven by the food sector, according to the figures for the second quarter of the year by the British Retail Consortium (BRC). \nThe number of workers fell by 2.4% compared with the same period last year, with “deep declines” reported in April and May.", "external_links": [], "published": "2016-07-28T16:11:00.000+03:00", "crawled": "2016-07-28T16:27:23.273+03:00", "highlightTitle": ""}