{"organizations": ["Cabinet", "Rural Affairs", "Defence", "Loughborough", "Transport", "Phillip Hammond  Education", "Justice", "Local Government"], "uuid": "ba78d1aee5b3fafe96a2360d5247f037c77cfd6b", "thread": {"social": {"gplus": {"shares": 0}, "pinterest": {"shares": 0}, "vk": {"shares": 0}, "linkedin": {"shares": 0}, "facebook": {"likes": 0, "shares": 0, "comments": 0}, "stumbledupon": {"shares": 0}}, "site_full": "www.leicestermercury.co.uk", "main_image": "http://www.leicestermercury.co.uk/images/localworld/ugc-images/276308/Article/images/29513076/14893325.jpg", "site_section": "http://www.thisisleicestershire.co.uk/weathernews/rss.html?chid=182806", "section_title": "Leicester Mercury All Content Feed", "url": "http://www.leicestermercury.co.uk/keeping-up-with-the-cabinet-reshuffle-latest-on-the-hiring-and-firing/story-29513076-detail/story.html", "country": "GB", "domain_rank": 48128, "title": "danjmartin published Keeping up with the Cabinet reshuffle? Latest on the hiring and...", "performance_score": 0, "site": "leicestermercury.co.uk", "participants_count": 1, "title_full": "danjmartin published Keeping up with the Cabinet reshuffle? Latest on the hiring and...", "spam_score": 0.0, "site_type": "news", "published": "2016-07-14T17:30:00.000+03:00", "replies_count": 0, "uuid": "ba78d1aee5b3fafe96a2360d5247f037c77cfd6b"}, "author": "danjmartin", "url": "http://www.leicestermercury.co.uk/keeping-up-with-the-cabinet-reshuffle-latest-on-the-hiring-and-firing/story-29513076-detail/story.html", "ord_in_thread": 0, "title": "danjmartin published Keeping up with the Cabinet reshuffle? Latest on the hiring and...", "locations": ["Downi"], "entities": {"persons": [{"name": "chris grayling", "sentiment": "none"}, {"name": "michael fallon", "sentiment": "none"}, {"name": "michael gove", "sentiment": "none"}, {"name": "rudd", "sentiment": "none"}, {"name": "stephen crabb", "sentiment": "none"}, {"name": "theresa may", "sentiment": "none"}, {"name": "jeremy hunt", "sentiment": "none"}, {"name": "damian green", "sentiment": "none"}, {"name": "nicky morgan", "sentiment": "none"}, {"name": "george osborne", "sentiment": "none"}, {"name": "liam fox", "sentiment": "none"}, {"name": "gavin williamson", "sentiment": "none"}, {"name": "liz truss in", "sentiment": "none"}, {"name": "david davis", "sentiment": "none"}, {"name": "phillip hammond", "sentiment": "none"}, {"name": "sajid javid", "sentiment": "none"}, {"name": "andrea leadsom", "sentiment": "none"}, {"name": "boris johnson", "sentiment": "none"}, {"name": "justine greening", "sentiment": "none"}], "locations": [{"name": "downi", "sentiment": "none"}], "organizations": [{"name": "cabinet", "sentiment": "none"}, {"name": "rural affairs", "sentiment": "none"}, {"name": "defence", "sentiment": "none"}, {"name": "loughborough", "sentiment": "none"}, {"name": "transport", "sentiment": "none"}, {"name": "phillip hammond  education", "sentiment": "none"}, {"name": "justice", "sentiment": "none"}, {"name": "local government", "sentiment": "none"}]}, "highlightText": "", "language": "english", "persons": ["Chris Grayling", "Michael Fallon", "Michael Gove", "Rudd", "Stephen Crabb", "Theresa May", "Jeremy Hunt", "Damian Green", "Nicky Morgan", "George Osborne", "Liam Fox", "Gavin Williamson", "Liz Truss In", "David Davis", "Phillip Hammond", "Sajid Javid", "Andrea Leadsom", "Boris Johnson", "Justine Greening"], "text": "Keeping up with the Cabinet reshuffle? Latest on the hiring and firing in Downing Street By danjmartin | Posted: July 14, 2016 0 COMMENTS SHARES Damian Green - the New DWP boss at Number 10 Keeping up with the Cabinet reshuffle? Latest on the hiring and firing in Downi... X \nCopy link to paste in your message / \nNew Prime Minister Theresa May has been reshuffling her cabinet. \nHere is the latest on who has been hired and fired. \nChancellor of the Exchequer - Phillip Hammond grabs the purse strings from George Osborne \nHome Secretary - Amber Rudd replaces Theresa May \nForeign Secretary - Boris Johnson zip-wires in for Phillip Hammond \nEducation Secretary - Loughborough MP Nicky Morgan expelled and with Justine Greening going to the top of the class \nBrexit minister - David Davis enters before exiting \nDefence Secretary - Michael Fallon remains in command \nHealth Secretary - Jeremy Hunt - reports of his death greatly exaggerated \nInternational Trade - Liam Fox takes over \nJustice Secretary - Liz Truss In, Michael Gove sent into exile. \nTransport Secretary - Chris Grayling - All aboard. \nSecretary of State for Work and Pensions - Damian Green replaces Stephen Crabb who moves out of Government, not sideways. \nSecretary of State for Environment, Food and Rural Affairs - Andrea Leadsom digs in \nCommunities and Local Government secretary - Sajid Javid takes over \nChief Whip - Gavin Williamson cracking on", "external_links": [], "published": "2016-07-14T17:30:00.000+03:00", "crawled": "2016-07-14T19:16:55.491+03:00", "highlightTitle": ""}