{"organizations": ["Pantheon Macroeconomics", "Brady/PA Wire Cranes", "ETX Capital", "European Union", "MPC", "Markit", "Bank", "Bank’s) Monetary Policy Committee", "Bank of England"], "uuid": "dba8faa6c3d8b1412d84706103f09c42c564002a", "thread": {"social": {"gplus": {"shares": 0}, "pinterest": {"shares": 0}, "vk": {"shares": 0}, "linkedin": {"shares": 0}, "facebook": {"likes": 0, "shares": 0, "comments": 0}, "stumbledupon": {"shares": 0}}, "site_full": "www.chroniclelive.co.uk", "main_image": "http://i1.chroniclelive.co.uk/incoming/article11651747.ece/ALTERNATES/s1200/JS95449437.jpg", "site_section": "http://www.chroniclelive.co.uk/?service=rss", "section_title": "nechronicle - Home", "url": "http://www.chroniclelive.co.uk/business/business-news/recession-warning-after-uk-economy-11651557", "country": "GB", "domain_rank": 21960, "title": "Recession warning after UK economy sees worst slump since financial crisis", "performance_score": 0, "site": "chroniclelive.co.uk", "participants_count": 1, "title_full": "Recession warning after UK economy sees worst slump since financial crisis", "spam_score": 0.0, "site_type": "news", "published": "2016-07-22T16:45:00.000+03:00", "replies_count": 0, "uuid": "dba8faa6c3d8b1412d84706103f09c42c564002a"}, "author": "Agency Staff", "url": "http://www.chroniclelive.co.uk/business/business-news/recession-warning-after-uk-economy-11651557", "ord_in_thread": 0, "title": "Recession warning after UK economy sees worst slump since financial crisis", "locations": ["UK", "Britain", "EU", "London"], "entities": {"persons": [{"name": "jonathan", "sentiment": "none"}, {"name": "chris williamson", "sentiment": "none"}, {"name": "samuel tombs", "sentiment": "none"}, {"name": "neil wilson", "sentiment": "none"}], "locations": [{"name": "uk", "sentiment": "none"}, {"name": "britain", "sentiment": "none"}, {"name": "eu", "sentiment": "none"}, {"name": "london", "sentiment": "none"}], "organizations": [{"name": "pantheon macroeconomics", "sentiment": "none"}, {"name": "brady/pa wire cranes", "sentiment": "none"}, {"name": "etx capital", "sentiment": "none"}, {"name": "european union", "sentiment": "none"}, {"name": "mpc", "sentiment": "none"}, {"name": "markit", "sentiment": "none"}, {"name": "bank", "sentiment": "none"}, {"name": "bank’s) monetary policy committee", "sentiment": "none"}, {"name": "bank of england", "sentiment": "none"}]}, "highlightText": "", "language": "english", "persons": ["Jonathan", "Chris Williamson", "Samuel Tombs", "Neil Wilson"], "text": "Recession warning after UK economy sees worst slump since financial crisis 14:45, 22 Jul 2016 14:45, 22 Jul 2016 By Agency Staff Survey has heightened fears of a major slowdown in the economy following the vote to leave the European Union Shares Get business news by email Jonathan Brady/PA Wire Cranes on a construction site in London, as a report said that the UK economy has slumped at its fastest rate since the financial crisis in the wake of Britain's vote to leave the European Union \nThe UK economy has slumped at its fastest rate since the financial crisis in the wake of Britain’s vote to leave the European Union , a report said. \nThe Markit Flash UK Composite Output Index plummeted to its lowest level since April 2009, falling to 47.7 in July, compared to 52.4 in June, where a reading above 50 indicates growth. \nThe sharp contraction was triggered by falling output and orders for the first time since the end of 2012, while business optimism in Britain’s powerhouse services sector hit a seven-and-a-half-year low. \nThe data, collected between July 12 and 21, provides a stark picture of the state of the economy following the Brexit vote, with City experts now warning that Britain could be heading for a recession. \nSterling was down 0.2% against the dollar at 1.318 US dollars after the report was published, while the pound also fell 0.3% against the euro at 1.195 euro. \nChris Williamson, chief economist at Markit, said the update showed a “dramatic deterioration” in the UK economy and expects gross domestic product (GDP) to contract by 0.4% in the third quarter. \n“The downturn, whether manifesting itself in order book cancellations, a lack of new orders or the postponement or halting of projects, was most commonly attributed in one way or another to Brexit.” Read More Construction industry suffers shock slump in run-up to EU referendum \nHe added: “Given the record slump in service sector business expectations, the suggestion is that there is further pain to come in the short term at least.” \nThe study found that its flash UK services PMI (purchasing managers’ index) hit an 88-month low of 47.4 this month, compared to 52.3 in June. \nThe flash UK manufacturing PMI was also in the doldrums, slipping to a 41-month low of 49.1 in July, after a reading of 52.1 the month before. \nThe flash UK manufacturing PMI output index also dropped from 52.9 to 49.1 over the period. \nThe report said the downturn in the services sector was “more marked” than in manufacturing, with services activity and new orders dropping at their quickest rate for seven years. \nBut while output and new orders also came under pressure in the manufacturing sector, its new export business rose for the second straight month, boosted in part by the sharp drop in sterling following the Brexit vote. \nThe update comes after the Bank of England said on Wednesday that business uncertainty had “risen markedly” since the referendum result - but there was “no clear evidence” of a sharp economic slowdown. Read More Fresh concerns over UK manufacturing after report claims it is 'close to stagnation' \nHowever, Neil Wilson, markets analyst at ETX Capital, said the flash PMI data showed that Britain should be bracing itself for another recession, while the Bank of England should move to cut interest rates in August. \n“The readings suggest we are heading for a recession again and it is almost certain the Bank of England will pull the trigger on aggressive stimulus to boost aggregate demand. \nHe added: “The Bank will throw the kitchen sink at this now.” \nSamuel Tombs, chief UK economist at Pantheon Macroeconomics, said: “The collapse in the composite PMI to its lowest level since April 2009 provides the first major evidence that the UK is entering a sharp downturn.” \nHe added: “The chart shows that the composite PMI has fallen to a level that has persuaded the (Bank’s) Monetary Policy Committee (MPC) to cut interest rates by about 50 basis points in the past.” More on the EU Referendum", "external_links": [], "published": "2016-07-22T16:45:00.000+03:00", "crawled": "2016-07-22T17:32:04.313+03:00", "highlightTitle": ""}